<?xml version="1.0" encoding="UTF-8"?>
<?xml-stylesheet type="text/xsl"  href="testresult.xsl"?>
<test_definition name="http://tempuri.org" type=""
	xmlns:xsi="http://www.w3.org/2001/XMLSchema-instance"
	xsi:noNamespaceSchemaLocation="test_definition.xsd">
	<environment>
		<other></other>
	</environment>
	<summary test_plan_name="tmp_test_1">
		<start_at>Fri Jul 13 04:04:59 CST 2012</start_at>
		<end_at>Fri Jul 13 05:01:53 CST 2012</end_at>
	</summary>
	<suite name="webapi-tizen-alarm-tests" type="">
		<set name="Alarm1">
			<testcase component="WebAPI/Tizen/Alarm" execution_type="auto"
				id="Alarm_AlarmRelative_constructor_delay11" priority="P1"
				purpose="check AlarmRelative attribute when create with delay11 Not Run is expected"
				status="approved" type="compliance" result="Not Run">
				<description>
					<pre_condition />
					<post_condition />
					<steps>
						<step order="1">
							<step_desc>check AlarmRelative create constructor with delay
							</step_desc>
							<expected>AlarmRelative create succeed with constructor with
								delay
							</expected>
						</step>
					</steps>
					<test_script_entry test_script_expected_result="0">/opt/webapi-tizen-alarm-tests/Alarm/Alarm_AlarmRelative_constructor_delay.htm
					</test_script_entry>
				</description>
				<specs>
					<spec>
						<spec_assertion category="Tizen Device API Specifications"
							section="Widget" specification="Widget Packaging and XML Configuration"
							interface="Widget" usage="true" />
						<spec_url>http://www.w3.org/TR/widgets-apis/</spec_url>
						<spec_statement>spec_statement</spec_statement>
					</spec>
				</specs>
				<result_info>
					<actual_result>Not Run</actual_result>
					<start>Sat Jan 01 2000 13:43:44 GMT+0900 (KST)</start>
					<end>Sat Jan 01 2000 13:43:46 GMT+0900 (KST)</end>
					<stdout />
				</result_info>
			</testcase>
			<testcase component="WebAPI/Tizen/Alarm" execution_type="auto"
				id="Alarm_AlarmManager_get" priority="P1"
				purpose="check AlarmManager method removeAll: without input attribute"
				status="approved" type="compliance" result="BLOCK">
				<description>
					<pre_condition />
					<post_condition />
					<steps>
						<step order="1">
							<step_desc>check AlarmManager method get: default check
							</step_desc>
							<expected>AlarmManager method get: default check succeed
							</expected>
						</step>
					</steps>
					<test_script_entry test_script_expected_result="0">/opt/webapi-tizen-alarm-tests/Alarm/Alarm_AlarmManager_get.htm
					</test_script_entry>
				</description>
				<specs>
					<spec>
						<spec_assertion category="Tizen Device API Specifications"
							section="Widget" specification="Widget Packaging and XML Configuration"
							interface="Widget" usage="true" />
						<spec_url>http://www.w3.org/TR/widgets-apis/</spec_url>
						<spec_statement>spec_statement</spec_statement>
					</spec>
				</specs>
				<result_info>
					<actual_result>BLOCK</actual_result>
					<start>Sat Jan 01 2000 13:43:46 GMT+0900 (KST)</start>
					<end>Sat Jan 01 2000 13:44:02 GMT+0900 (KST)</end>
					<stdout>Test time out</stdout>
				</result_info>
			</testcase>
			<testcase component="WebAPI/Tizen/Alarm" execution_type="auto"
				id="Alarm_AlarmAbsolute_attri_date_01" priority="P1"
				purpose="check AlarmAbsolute attribute when create with date"
				status="approved" type="compliance">
				<description>
					<pre_condition />
					<post_condition />
					<steps>
						<step order="1">
							<step_desc>check AlarmAbsolute attribute when create with date
							</step_desc>
							<expected>AlarmAbsolute attribute return correct value when
								create with date
							</expected>
						</step>
					</steps>
					<test_script_entry test_script_expected_result="0">/opt/webapi-tizen-alarm-tests/Alarm/Alarm_AlarmAbsolute_attri_date.htm?total_num=3&amp;locator_key=id&amp;value=1
					</test_script_entry>
				</description>
				<specs>
					<spec>
						<spec_assertion category="Tizen Device API Specifications"
							section="Widget" specification="Widget Packaging and XML Configuration"
							interface="Widget" usage="true" />
						<spec_url>http://www.w3.org/TR/widgets-apis/</spec_url>
						<spec_statement>spec_statement</spec_statement>
					</spec>
				</specs>
				<result_info>
					<actual_result>N/R</actual_result>
					<start>Sat Jan 01 2000 13:44:02 GMT+0900 (KST)</start>
					<end>Sat Jan 01 2000 13:44:05 GMT+0900 (KST)</end>
					<stdout />
				</result_info>
			</testcase>
			<testcase component="WebAPI/Tizen/Alarm" execution_type="auto"
				id="Alarm_AlarmManager_add_rel" priority="P1"
				purpose="check AlarmManager method add: add relative alarm" status="approved"
				type="compliance" result="FAIL">
				<description>
					<pre_condition />
					<post_condition />
					<steps>
						<step order="1">
							<step_desc>check AlarmManager method add: add relative alarm
							</step_desc>
							<expected>AlarmManager method add: add relative alarm succeed
							</expected>
						</step>
					</steps>
					<test_script_entry test_script_expected_result="0">/opt/webapi-tizen-alarm-tests/Alarm/Alarm_AlarmManager_add_rel.htm
					</test_script_entry>
				</description>
				<specs>
					<spec>
						<spec_assertion category="Tizen Device API Specifications"
							section="Widget" specification="Widget Packaging and XML Configuration"
							interface="Widget" usage="true" />
						<spec_url>http://www.w3.org/TR/widgets-apis/</spec_url>
						<spec_statement>spec_statement</spec_statement>
					</spec>
				</specs>
				<result_info>
					<actual_result>FAIL</actual_result>
					<start>Sat Jan 01 2000 13:44:05 GMT+0900 (KST)</start>
					<end>Sat Jan 01 2000 13:44:21 GMT+0900 (KST)</end>
					<stdout>Test time out</stdout>
				</result_info>
			</testcase>
			<testcase component="WebAPI/Tizen/Alarm" execution_type="auto"
				id="Alarm_AlarmRelative_attri_delay_02" priority="P1"
				purpose="check AlarmAbsolute attribute when create with period"
				status="approved" type="compliance" result="FAIL">
				<description>
					<pre_condition />
					<post_condition />
					<steps>
						<step order="1">
							<step_desc>check AlarmRelative attribute when create with delay
							</step_desc>
							<expected>AlarmRelative attribute return correct value when
								create succeed with with delay
							</expected>
						</step>
					</steps>
					<test_script_entry test_script_expected_result="0">/opt/webapi-tizen-alarm-tests/Alarm/Alarm_AlarmRelative_attri_delay.htm?total_num=2&amp;locator_key=id&amp;value=2
					</test_script_entry>
				</description>
				<specs>
					<spec>
						<spec_assertion category="Tizen Device API Specifications"
							section="Widget" specification="Widget Packaging and XML Configuration"
							interface="Widget" usage="true" />
						<spec_url>http://www.w3.org/TR/widgets-apis/</spec_url>
						<spec_statement>spec_statement</spec_statement>
					</spec>
				</specs>
				<result_info>
					<actual_result>FAIL</actual_result>
					<start>Sat Jan 01 2000 13:44:21 GMT+0900 (KST)</start>
					<end>Sat Jan 01 2000 13:44:23 GMT+0900 (KST)</end>
					<stdout />
				</result_info>
			</testcase>
			<testcase component="WebAPI/Tizen/Alarm" execution_type="auto"
				id="Alarm_AlarmManager_getAll" priority="P1"
				purpose="check AlarmManager method getAll: default check" status="approved"
				type="compliance" result="FAIL">
				<description>
					<pre_condition />
					<post_condition />
					<steps>
						<step order="1">
							<step_desc>check AlarmManager method getAll: default check
							</step_desc>
							<expected>AlarmManager method getAll: default check succeed
							</expected>
						</step>
					</steps>
					<test_script_entry test_script_expected_result="0">/opt/webapi-tizen-alarm-tests/Alarm/Alarm_AlarmManager_getAll.htm
					</test_script_entry>
				</description>
				<specs>
					<spec>
						<spec_assertion category="Tizen Device API Specifications"
							section="Widget" specification="Widget Packaging and XML Configuration"
							interface="Widget" usage="true" />
						<spec_url>http://www.w3.org/TR/widgets-apis/</spec_url>
						<spec_statement>spec_statement</spec_statement>
					</spec>
				</specs>
				<result_info>
					<actual_result>FAIL</actual_result>
					<start>Sat Jan 01 2000 13:44:23 GMT+0900 (KST)</start>
					<end>Sat Jan 01 2000 13:44:39 GMT+0900 (KST)</end>
					<stdout>Test time out</stdout>
				</result_info>
			</testcase>
			<testcase component="WebAPI/Tizen/Alarm" execution_type="auto"
				id="Alarm_AlarmAbsolute_attri_date_03" priority="P1"
				purpose="check AlarmAbsolute attribute when create with date"
				status="approved" type="compliance" result="Blocked">
				<description>
					<pre_condition />
					<post_condition />
					<steps>
						<step order="1">
							<step_desc>check AlarmAbsolute attribute when create with date
							</step_desc>
							<expected>AlarmAbsolute attribute return correct value when
								create with date
							</expected>
						</step>
					</steps>
					<test_script_entry test_script_expected_result="0">/opt/webapi-tizen-alarm-tests/Alarm/Alarm_AlarmAbsolute_attri_date.htm?total_num=3&amp;locator_key=id&amp;value=3
					</test_script_entry>
				</description>
				<specs>
					<spec>
						<spec_assertion category="Tizen Device API Specifications"
							section="Widget" specification="Widget Packaging and XML Configuration"
							interface="Widget" usage="true" />
						<spec_url>http://www.w3.org/TR/widgets-apis/</spec_url>
						<spec_statement>spec_statement</spec_statement>
					</spec>
				</specs>
				<result_info>
					<actual_result>FAIL</actual_result>